[
  {
    "phrase": "Polahé anteng kitiran",
    "literal_meaning": "Tingkahnya tenang seperti baling-baling",
    "actual_meaning": "Tingkahnya sangat lasak/hiperaktif (tidak bisa diam)",
    "philosophy": "Menyindir orang yang tidak bisa duduk diam dengan membandingkannya pada benda yang berputar kencang."
  },
  {
    "phrase": "Tatuné arang kranjang",
    "literal_meaning": "Lukanya jarang (seperti anyaman) keranjang",
    "actual_meaning": "Lukanya sangat banyak/penuh sekujur tubuh",
    "philosophy": "Keranjang anyaman itu lubangnya banyak sekali. 'Jarang' versi keranjang berarti rapat versi manusia."
  },
  {
    "phrase": "Legi bratawali",
    "literal_meaning": "Manis seperti tanaman bratawali",
    "actual_meaning": "Sangat pahit",
    "philosophy": "Bratawali adalah tanaman obat yang sangat pahit. Sindiran untuk nasib atau obat."
  },
  {
    "phrase": "Awaké kera welut",
    "literal_meaning": "Badannya kurus seperti belut",
    "actual_meaning": "Badannya sangat gemuk",
    "philosophy": "Belut itu licin dan bulat/berisi. Menyebut 'kurus' pada belut adalah sarkasme untuk orang gemuk."
  },
  {
    "phrase": "Suwe mijet wohing ranti",
    "literal_meaning": "Lama seperti memencet buah ranti (tomat kecil)",
    "actual_meaning": "Sangat cepat",
    "philosophy": "Buah ranti itu lunak, memencetnya cuma butuh sedetik. Kalau dibilang 'lama' seperti itu, artinya sekejap mata."
  },
  {
    "phrase": "Pikirane landhep dengkul",
    "literal_meaning": "Pikirannya tajam seperti lutut",
    "actual_meaning": "Sangat bodoh/tumpul",
    "philosophy": "Lutut itu tumpul. Kalau dibilang tajam seperti lutut, artinya otaknya tidak bisa dipakai mikir."
  },
  {
    "phrase": "Peremponé pait madu",
    "literal_meaning": "Senyumnya pahit seperti madu",
    "actual_meaning": "Senyumnya sangat manis",
    "philosophy": "Madu itu manis. Pahitnya madu adalah kemustahilan, jadi maknanya adalah level manis tertinggi."
  }
]